"id","max_length","generation_method","n_retrieval_docs","top_k","userprompt","n_tokens","doc_indices","perplexity"
"0","20","beam","1","15","Answer the question: who sang theme song for license to kill?","1","60","22974.232421875"
"1","20","beam","1","15","Answer the question: a concave mirror can form a real image which is a copy of an object that forms?","1","23","5873.86669921875"
"2","20","beam","1","15","Answer the question: who wore number 7 for the green bay packers?","1","93","18274.849609375"
"3","20","beam","1","15","Answer the question: where does patience is a virtue come from?","1","74","13536.2607421875"
"4","20","beam","1","15","Answer the question: who wrote ain't living long like this?","1","38","14129.5634765625"
"5","20","beam","1","15","Answer the question: who played the mom on what's eating gilbert grape?","1","25","3490.8642578125"
"6","20","beam","1","15","Answer the question: where do secondary xylem and phloem cells arise from?","1","92","6337.94384765625"
"7","20","beam","1","15","Answer the question: who added a press room to the white house?","1","52","19648.5234375"
"8","20","beam","1","15","Answer the question: nodding your head no is an example of?","1","91","29231.046875"
"9","20","beam","1","15","Answer the question: who sings the theme tune to mum on bbc2?","1","33","2758.23583984375"
"10","20","beam","1","15","Answer the question: who played the detective in little boy blue?","1","68","18281.857421875"
"11","20","beam","1","15","Answer the question: when was the first horrid henry book written?","1","31","13844.78125"
"12","20","beam","1","15","Answer the question: who plays grace in the secret life of the american teenager?","1","81","8318.001953125"
"13","20","beam","1","15","Answer the question: who has won the canada open women's doubles?","1","63","10900.4599609375"
"14","20","beam","1","15","Answer the question: where does the last name waller come from?","1","45","3561.2841796875"
"15","20","beam","1","15","Answer the question: who wrote how do you do it by gerry and the pacemakers?","1","53","7405.71630859375"
"16","20","beam","1","15","Answer the question: what type of reproduction do whiptail lizards use?","1","67","4418.6943359375"
"17","20","beam","1","15","Answer the question: who sings i don't want to be lonely?","1","78","6165.8828125"
"18","20","beam","1","15","Answer the question: who wrote song what a friend we have in jesus?","1","27","3332.499267578125"
"19","20","beam","1","15","Answer the question: who is the original singer of just when i needed you most?","1","39","5248.0849609375"
"20","20","beam","1","15","Answer the question: what allows chyme to enter the small intestine?","1","69","21388.236328125"
"21","20","beam","1","15","Answer the question: where would the group bacteroids likely be found?","1","42","30046.173828125"
"22","20","beam","1","15","Answer the question: where does the last name andersen originate from?","1","66","15958.208984375"
"23","20","beam","1","15","Answer the question: how long did the democrats control the house and senate?","1","9","9101.623046875"
"24","20","beam","1","15","Answer the question: who sang in the movie i walk the line?","1","26","26278.015625"
"25","20","beam","1","15","Answer the question: who is the premier of northern cape 2018?","1","59","26479.5703125"
"26","20","beam","1","15","Answer the question: who owns the biggest house in beverly hills?","1","18","14932.306640625"
"27","20","beam","1","15","Answer the question: who sings god is great beer is good?","1","89","32168.751953125"
"28","20","beam","1","15","Answer the question: what does the air gap do on a dishwasher?","1","87","4474.6064453125"
"29","20","beam","1","15","Answer the question: who is the first indian climber of mount everest?","1","97","2748.370849609375"
"30","20","beam","1","15","Answer the question: what is in a pat o brien hurricane?","1","7","28837.669921875"
"31","20","beam","1","15","Answer the question: what is the name of son of lord krishna?","1","44","6102.19580078125"
"32","20","beam","1","15","Answer the question: who played anna in once upon a time?","1","84","5813.62841796875"
"33","20","beam","1","15","Answer the question: what is the average salary for a us congressman?","1","96","13168.8818359375"
"34","20","beam","1","15","Answer the question: what type of joint connects the incus with the malleus?","1","15","1891.935791015625"
"35","20","beam","1","15","Answer the question: when was the lupus foundation of america founded?","1","17","9050.6416015625"
"36","20","beam","1","15","Answer the question: what started the war between us and japan?","1","41","21984.1171875"
"37","20","beam","1","15","Answer the question: who sang i put a spell on you in hocus pocus?","1","24","6018.14697265625"
"38","20","beam","1","15","Answer the question: who played jennifer in back to the future?","1","21","5794.482421875"
"39","20","beam","1","15","Answer the question: where are the cardiac and vasomotor centers found?","1","22","3510.457763671875"
"40","20","beam","1","15","Answer the question: who was the first to say i'm going to disney world?","1","50","12367.763671875"
"41","20","beam","1","15","Answer the question: who sings the whiskey ain't workin anymore?","1","12","12040.0771484375"
"42","20","beam","1","15","Answer the question: this inventor co-created the film fred ott’s sneeze?","1","20","11869.2607421875"
"43","20","beam","1","15","Answer the question: what goes on the bottom of shepherd's pie?","1","71","22071.40234375"
"44","20","beam","1","15","Answer the question: who sang the most number of songs in the world?","1","75","5920.98046875"
"45","20","beam","1","15","Answer the question: who owns spirit of the suwannee music park?","1","57","6628.46484375"
"46","20","beam","1","15","Answer the question: who is the singer of kal ho na ho?","1","36","5749.20849609375"
"47","20","beam","1","15","Answer the question: what episode does marnie come back in geordie shore?","1","13","19648.111328125"
"48","20","beam","1","15","Answer the question: is jaffa cakes a biscuit or a cake?","1","55","6792.80908203125"
"49","20","beam","1","15","Answer the question: who sings love will keep us alive by the eagles?","1","14","4743.37060546875"
"50","20","beam","1","15","Answer the question: who sings the theme song for the tv show cops?","1","70","21895.443359375"
"51","20","beam","1","15","Answer the question: when did 10 shilling note go out of circulation?","1","2","14085.76953125"
"52","20","beam","1","15","Answer the question: who sang the songs on walk the line?","1","47","23252.828125"
"53","20","beam","1","15","Answer the question: who sang the song should have been a cowboy?","1","77","18640.373046875"
"54","20","beam","1","15","Answer the question: who sang i ran all the way home?","1","1","20247.986328125"
"55","20","beam","1","15","Answer the question: what is the second largest country in asia?","1","16","14911.07421875"
"56","20","beam","1","15","Answer the question: who sang the theme song for the man with the golden gun?","1","32","21358.333984375"
"57","20","beam","1","15","Answer the question: where does the last name roberts come from?","1","54","7785.48388671875"
"58","20","beam","1","15","Answer the question: what type of plate boundary is associated with iceland and its volcanic eruptions?","1","83","2444.780517578125"
"59","20","beam","1","15","Answer the question: who is the captain of richmond football club?","1","51","19454.013671875"
"60","20","beam","1","15","Answer the question: what's the difference between salisbury steak and hamburger steak?","1","80","4126.6572265625"
"61","20","beam","1","15","Answer the question: where is the heart of palm on a palm tree?","1","79","9871.9208984375"
"62","20","beam","1","15","Answer the question: who won the 10m air pistol gold medal at commonwealth shooting championship in brisbane australia?","1","61","2392.89013671875"
"63","20","beam","1","15","Answer the question: how old do you have to be to get a gun licence in nz?","1","46","6146.9892578125"
"64","20","beam","1","15","Answer the question: what is the meaning of gorakh dhanda in urdu?","1","65","2625.410400390625"
"65","20","beam","1","15","Answer the question: when did the song things that make you go hmmm come out?","1","29","10401.73828125"
"66","20","beam","1","15","Answer the question: cast of the have and have nots play?","1","98","6022.35546875"
"67","20","beam","1","15","Answer the question: where does the last name orozco originate from?","1","8","8251.146484375"
"68","20","beam","1","15","Answer the question: what is the name of india pakistan border?","1","58","9260.12109375"
"69","20","beam","1","15","Answer the question: which british city is farthest from the sea?","1","11","5650.32421875"
"70","20","beam","1","15","Answer the question: who played mrs warboys in one foot in the grave?","1","35","2940.353759765625"
"71","20","beam","1","15","Answer the question: who stepped out of the dithyrambic chorus to become the first actor?","1","19","5225.76025390625"
"72","20","beam","1","15","Answer the question: where was the salvation army's christmas collection kettle first introduced?","1","40","14379.5810546875"
"73","20","beam","1","15","Answer the question: sequel to a christmas story it runs in the family?","1","82","19152.060546875"
"74","20","beam","1","15","Answer the question: where was because i could not stop for death published?","1","4","13840.318359375"
"75","20","beam","1","15","Answer the question: where does kfc get their chicken in south africa?","1","43","6150.12646484375"
"76","20","beam","1","15","Answer the question: who won the super heavyweight gold medal at the 2000 olympics?","1","88","5516.50341796875"
"77","20","beam","1","15","Answer the question: when did men's curling start in the olympics?","1","28","6153.74609375"
"78","20","beam","1","15","Answer the question: which state is the richest state in nigeria?","1","10","54761.2421875"
"79","20","beam","1","15","Answer the question: who wrote if she knew what she wants?","1","37","8206.1337890625"
"80","20","beam","1","15","Answer the question: where was the film coming home for christmas filmed?","1","86","12118.15625"
"81","20","beam","1","15","Answer the question: who plays the mother of howard on big bang theory?","1","5","5409.25244140625"
"82","20","beam","1","15","Answer the question: who was the dj on in living color?","1","94","22052.361328125"
"83","20","beam","1","15","Answer the question: when did the granite mountain hotshots get certified?","1","56","13709.712890625"
"84","20","beam","1","15","Answer the question: who has been appointed as the election commissioner of india?","1","6","3490.584716796875"
"85","20","beam","1","15","Answer the question: what is the ultimate objective of financial management?","1","76","39512.84375"
"86","20","beam","1","15","Answer the question: new movie of ajay devgan and sonakshi sinha?","1","72","13261.6279296875"
"87","20","beam","1","15","Answer the question: who kidnapped ben in the deep end of the ocean?","1","85","11978.4716796875"
"88","20","beam","1","15","Answer the question: university of michigan school of public health ranking?","1","90","20261.525390625"
"89","20","beam","1","15","Answer the question: what is the name of the gap between two front teeth?","1","48","8322.18359375"
"90","20","beam","1","15","Answer the question: who plays colin on young and the restless?","1","0","21922.228515625"
"91","20","beam","1","15","Answer the question: when was the last time tug-of-war was an official olympic sport?","1","49","4119.5244140625"
"92","20","beam","1","15","Answer the question: who is the actress who plays baker on blue bloods?","1","95","5248.3349609375"
"93","20","beam","1","15","Answer the question: what is the function of the pericardial sac?","1","73","3048.438232421875"
"94","20","beam","1","15","Answer the question: who won the 2017 sports personality of the year?","1","30","15882.0537109375"
"95","20","beam","1","15","Answer the question: when did bihar bifurcate from bengal and some parts of chota nagpur merged into bengal?","1","62","4121.43798828125"
"96","20","beam","1","15","Answer the question: what was the first capital city of australia?","1","34","22125.732421875"
"97","20","beam","1","15","Answer the question: who is the young man in hawthorne's my kinsman major molineux?","1","99","5011.78515625"
"98","20","beam","1","15","Answer the question: who is the authority or governing body of mca?","1","64","27458.455078125"
"99","20","beam","1","15","Answer the question: who invented the cornell method of note taking?","1","3","8786.5078125"